{
  "id": "mfg-004",
  "part_no": "MTP-4004",
  "drawing_no": "D-24-0425",
  "revision": "B",
  "name": {
    "zh": "步進馬達安裝板",
    "en": "Stepper Motor Mounting Plate"
  },
  "category": "安裝板",
  "material": "A5052-H32 鋁板",
  "density_g_cm3": 2.68,
  "surface": "本色陽極處理",
  "company": "示範精密機械（虛構）",
  "owner": "自動化設備課",
  "confidentiality": "內部",
  "cad": "kb/cad/mfg-004.py",
  "drawing": "kb/drawings/mfg-004.png",
  "descriptions": [
    {
      "topic": "用途與組裝",
      "text": "本件用來固定 NEMA 23 步進馬達。馬達法蘭的 Ø38.1 定位凸台嵌入中心孔定心，4 支 M5 螺栓鎖在方距 47.14 mm 的孔位；板子四角的 18×6.6 長圓孔讓安裝板可沿 X 方向調整 ±6 mm，用來張緊皮帶。",
      "source": "組裝作業標準 AS-MTP-4004 rev.B"
    },
    {
      "topic": "加工製程",
      "text": "工序 10：板材剪切 125×105×10 mm。工序 20：CNC 綜合加工機以真空吸盤或壓板固定，面銑兩面至厚度 10±0.05。工序 30：Ø38.1 定位孔先以螺旋銑粗加工再精搪。工序 40：鑽 4-Ø5.5 孔，以 Ø6 端銑刀銑 4 個長圓孔。工序 50：外形精銑與去毛邊。工序 60：本色陽極處理。",
      "source": "製程規範 PS-MTP-4004 rev.B"
    },
    {
      "topic": "公差與檢驗",
      "text": "定位孔 Ø38.1H8（+0.039/0），4-Ø5.5 孔對定位孔的位置度 Ø0.1 mm；板厚 10±0.05 mm，平面度 0.1 mm。定位孔以塞規檢驗、孔位以三次元量床檢查，每批首件與末件各一次。",
      "source": "檢驗規範 QC-MTP-4004 rev.A"
    },
    {
      "topic": "常見不良與對策",
      "text": "10 mm 薄板銑削後容易翹曲，面銑時兩面輪流、分多刀去除，最後一刀切深不超過 0.2 mm。長圓孔兩端要是完整半圓，若用較小刀具分段加工，要注意接刀痕。",
      "source": "品質異常報告 QA-2025-058"
    }
  ],
  "tags": [
    "安裝板",
    "鋁板",
    "NEMA 23",
    "長圓孔",
    "CNC 銑削"
  ]
}
