{
  "id": "mfg-006",
  "part_no": "PBK-6006",
  "drawing_no": "D-24-0618",
  "revision": "D",
  "name": {
    "zh": "立式軸承座",
    "en": "Pillow Block Housing"
  },
  "category": "軸承座",
  "material": "FC250 灰口鑄鐵",
  "density_g_cm3": 7.25,
  "surface": "非加工面塗灰色防鏽漆",
  "company": "示範精密機械（虛構）",
  "owner": "機械設計課",
  "confidentiality": "機密",
  "cad": "kb/cad/mfg-006.py",
  "drawing": "kb/drawings/mfg-006.png",
  "descriptions": [
    {
      "topic": "用途與組裝",
      "text": "本件用於支撐輸送滾筒軸的軸承，Ø35H7 軸承孔裝入外徑 35 mm 的 6202 滾珠軸承。底座 2-Ø11 孔以 M10 螺栓鎖在機架上，頂部 Ø6 注油孔安裝 M6 黃油嘴，定期補充潤滑脂。",
      "source": "組裝作業標準 AS-PBK-6006 rev.D"
    },
    {
      "topic": "材料與熱處理",
      "text": "材料為 FC250 灰口鑄鐵，以砂模鑄造取得毛胚，鑄造後進行約 550 °C 的去應力退火，避免加工後變形。",
      "source": "材料規範 MS-FC250-03"
    },
    {
      "topic": "加工製程",
      "text": "工序 10：鑄件去毛邊、噴砂。工序 20：綜合加工機銑底面作為基準面。工序 30：以底面定位搪軸承孔 Ø35H7 並兩側倒角，確保中心高 40 mm。工序 40：鑽 2-Ø11 安裝孔。工序 50：鑽 Ø6 注油孔並攻 M6 螺紋。工序 60：非加工面塗漆。",
      "source": "製程規範 PS-PBK-6006 rev.D"
    },
    {
      "topic": "公差與檢驗",
      "text": "軸承孔 Ø35H7（+0.025/0），Ra 1.6；中心高 40±0.02 mm；軸承孔軸線對底面的平行度 0.02 mm；底面平面度 0.03 mm。軸承孔以內徑量錶 100% 檢驗，中心高以高度規抽驗。",
      "source": "檢驗規範 QC-PBK-6006 rev.C"
    },
    {
      "topic": "常見不良與對策",
      "text": "鑄件砂孔若出現在軸承孔內壁會直接報廢，進料時需抽樣剖檢。兩件軸承座成對使用時，中心高差需在 0.03 mm 以內，出貨時要成對標示。",
      "source": "品質異常報告 QA-2024-087"
    }
  ],
  "tags": [
    "軸承座",
    "鑄鐵",
    "搪孔",
    "注油孔",
    "FC250"
  ]
}
