{
  "id": "mfg-001",
  "part_no": "BRK-1001",
  "drawing_no": "D-24-0117",
  "revision": "B",
  "name": {
    "zh": "L 型固定支架",
    "en": "L-Bracket"
  },
  "category": "支架",
  "material": "A6061-T6 鋁合金",
  "density_g_cm3": 2.7,
  "surface": "黑色陽極處理（膜厚 10–15 μm）",
  "company": "示範精密機械（虛構）",
  "owner": "生產技術課",
  "confidentiality": "機密",
  "cad": "kb/cad/mfg-001.py",
  "drawing": "kb/drawings/mfg-001.png",
  "descriptions": [
    {
      "topic": "用途與組裝",
      "text": "本件是自動化輸送線的感測器安裝座：底板鎖在鋁擠型機架上，立板固定光電感測器支架，每條輸送線使用 4 件。底板以 4 支 M6×16 內六角螺栓固定，立板以 2 支 M8 螺栓連接感測器座；組裝扭力 M6 為 9 N·m、M8 為 22 N·m。",
      "source": "組裝作業標準 AS-BRK-1001 rev.B"
    },
    {
      "topic": "加工製程",
      "text": "工序 10：鋸床下料 85×55×65 mm 鋁塊。工序 20：CNC 立式綜合加工機（VMC）第一次裝夾，以虎鉗夾持，面銑底面與外形，粗銑 L 型內角，留 0.3 mm 精修量。工序 30：翻面第二次裝夾，精銑內角與各面至尺寸，以 Ø10 端銑刀清角。工序 40：鑽底板 4-Ø6.6 與立板 2-Ø8.5 通孔並去毛邊。工序 50：委外黑色陽極處理。",
      "source": "製程規範 PS-BRK-1001 rev.B"
    },
    {
      "topic": "公差與檢驗",
      "text": "未註公差依 ISO 2768-m。孔位公差 ±0.1 mm，底板與立板垂直度 0.05 mm，底面平面度 0.05 mm。首件以三次元量床（CMM）全尺寸檢驗，量產每 20 件抽驗 1 件孔位與垂直度，並目視檢查陽極處理色差。",
      "source": "檢驗規範 QC-BRK-1001 rev.A"
    },
    {
      "topic": "常見不良與對策",
      "text": "過去的不良以立板垂直度超差為主，原因是第二次裝夾時虎鉗夾持力過大，使 8 mm 薄壁變形；對策是精銑前降低夾持壓力並改用軟爪。另曾發生陽極處理後孔徑縮小約 0.02 mm，目前孔徑已預留補償量。",
      "source": "品質異常報告 QA-2025-031"
    }
  ],
  "tags": [
    "支架",
    "鋁合金",
    "CNC 銑削",
    "陽極處理",
    "L 型"
  ]
}
