{
  "id": "mfg-007",
  "part_no": "FXP-7007",
  "drawing_no": "D-24-0709",
  "revision": "A",
  "name": {
    "zh": "治具定位板",
    "en": "Fixture Locating Plate"
  },
  "category": "治具零件",
  "material": "S50C 中碳鋼",
  "density_g_cm3": 7.85,
  "surface": "無電解鍍鎳",
  "company": "示範精密機械（虛構）",
  "owner": "生產技術課",
  "confidentiality": "機密",
  "cad": "kb/cad/mfg-007.py",
  "drawing": "kb/drawings/mfg-007.png",
  "descriptions": [
    {
      "topic": "用途與組裝",
      "text": "本件是 CNC 加工用的治具底板：工件以兩支 Ø10 定位銷（一圓一菱）定位，4 支 M8 沉頭螺栓把底板鎖在機台工作台上，中央 60×40×5 的避讓槽讓刀具加工穿孔時不會撞到底板。",
      "source": "治具作業標準 JS-FXP-7007 rev.A"
    },
    {
      "topic": "加工製程",
      "text": "工序 10：鋼板火焰切割 155×105×20 mm。工序 20：平面研磨兩面至厚度 15 mm。工序 30：綜合加工機鑽鉸 2-Ø10H7 定位銷孔。工序 40：鑽 4-Ø9 通孔並以沉頭刀加工 Ø14 深 8.6 沉頭。工序 50：銑中央避讓槽。工序 60：無電解鍍鎳。",
      "source": "製程規範 PS-FXP-7007 rev.A"
    },
    {
      "topic": "公差與檢驗",
      "text": "定位銷孔 Ø10H7（+0.015/0），兩孔中心距 138.9±0.01 mm；上下兩面平行度 0.01 mm。以三次元量床全檢孔距與平行度。",
      "source": "檢驗規範 QC-FXP-7007 rev.A"
    }
  ],
  "tags": [
    "治具",
    "定位銷",
    "沉頭孔",
    "平面研磨",
    "S50C"
  ]
}
