{
  "id": "mfg-005",
  "part_no": "TSN-5005",
  "drawing_no": "D-24-0502",
  "revision": "A",
  "name": {
    "zh": "T 型槽螺帽",
    "en": "T-Slot Nut"
  },
  "category": "治具零件",
  "material": "S45C 中碳鋼",
  "density_g_cm3": 7.85,
  "surface": "調質後發黑",
  "company": "示範精密機械（虛構）",
  "owner": "生產技術課",
  "confidentiality": "內部",
  "cad": "kb/cad/mfg-005.py",
  "drawing": "kb/drawings/mfg-005.png",
  "descriptions": [
    {
      "topic": "用途與組裝",
      "text": "本件是治具固定用的 T 型槽螺帽，配合工作台 14 mm 寬的 T 型槽使用。凸緣卡在 T 型槽底部，中心的 M10 螺紋孔搭配壓板與螺栓，把治具鎖緊在工作台上。",
      "source": "治具作業標準 JS-TSN-5005 rev.A"
    },
    {
      "topic": "加工製程",
      "text": "工序 10：以 25×20 mm 扁鋼鋸切長 42 mm。工序 20：銑床銑兩端面至長度 40。工序 30：以成形銑刀或兩次銑削加工 T 形輪廓，頸部寬 14 mm。工序 40：鑽 Ø8.5 底孔並攻 M10×1.5 螺紋，孔口倒角 C1。工序 50：調質後發黑。",
      "source": "製程規範 PS-TSN-5005 rev.A"
    },
    {
      "topic": "公差與檢驗",
      "text": "頸部寬 14（−0.1/−0.2）mm，確保能順利滑入 T 型槽；凸緣寬 24±0.1 mm；螺紋以 M10 通止規 100% 檢驗。",
      "source": "檢驗規範 QC-TSN-5005 rev.A"
    },
    {
      "topic": "常見不良與對策",
      "text": "最常見的問題是攻牙時絲攻斷在孔內，現改用螺旋絲攻並加切削油。頸部過寬會卡在 T 型槽內，出貨前抽樣以 T 型槽樣規實際試裝。",
      "source": "品質異常報告 QA-2025-009"
    }
  ],
  "tags": [
    "T 型槽",
    "螺帽",
    "S45C",
    "攻牙",
    "治具"
  ]
}
