{
  "id": "mfg-002",
  "part_no": "FLG-2002",
  "drawing_no": "D-24-0203",
  "revision": "C",
  "name": {
    "zh": "連接法蘭",
    "en": "Coupling Flange"
  },
  "category": "法蘭",
  "material": "S45C 中碳鋼",
  "density_g_cm3": 7.85,
  "surface": "發黑處理",
  "company": "示範精密機械（虛構）",
  "owner": "機械設計課",
  "confidentiality": "機密",
  "cad": "kb/cad/mfg-002.py",
  "drawing": "kb/drawings/mfg-002.png",
  "descriptions": [
    {
      "topic": "用途與組裝",
      "text": "本件用於減速機輸出軸與滾筒之間的剛性連接。中心孔 Ø30H7 與軸配合，6-Ø9 孔均布於 P.C.D. 76 mm 圓周，以 M8 螺栓對角順序分三次鎖緊，最終扭力 25 N·m。",
      "source": "組裝作業標準 AS-FLG-2002 rev.C"
    },
    {
      "topic": "材料與熱處理",
      "text": "材料為 S45C 中碳鋼，粗車後進行調質（淬火＋高溫回火）至硬度 HRC 22–28，兼顧強度與韌性；精加工後做發黑處理防鏽。",
      "source": "材料規範 MS-S45C-02"
    },
    {
      "topic": "加工製程",
      "text": "工序 10：鋸床下料 Ø105×26 mm 圓棒。工序 20：CNC 車床粗車外徑、凸轂與內孔，留 0.5 mm 精車量。工序 30：調質。工序 40：CNC 車床精車，內孔 Ø30H7 以精搪刀加工，並在同一次裝夾完成端面與凸轂，確保同心。工序 50：綜合加工機分度鑽 6-Ø9 孔。工序 60：發黑處理。",
      "source": "製程規範 PS-FLG-2002 rev.C"
    },
    {
      "topic": "公差與檢驗",
      "text": "中心孔 Ø30H7（+0.021/0），表面粗糙度 Ra 1.6；法蘭端面對中心孔的端面偏擺 0.02 mm，凸轂外徑對中心孔同心度 Ø0.03 mm，6 個螺栓孔的位置度 Ø0.1 mm。內孔以塞規 100% 檢驗，端面偏擺每批首件以千分錶檢測。",
      "source": "檢驗規範 QC-FLG-2002 rev.B"
    },
    {
      "topic": "常見不良與對策",
      "text": "曾因調質後變形導致端面偏擺超差，現改為調質後再精車端面。分度鑽孔時若第四軸回零不準，會造成 P.C.D. 位置度不良，每班開工前需校正分度盤。",
      "source": "品質異常報告 QA-2025-047"
    }
  ],
  "tags": [
    "法蘭",
    "S45C",
    "CNC 車削",
    "調質",
    "螺栓孔"
  ]
}
