{
  "id": "mfg-003",
  "part_no": "SFT-3003",
  "drawing_no": "D-24-0311",
  "revision": "A",
  "name": {
    "zh": "階梯傳動軸",
    "en": "Stepped Drive Shaft"
  },
  "category": "軸",
  "material": "SCM440 鉻鉬鋼",
  "density_g_cm3": 7.85,
  "surface": "軸承位高週波淬火",
  "company": "示範精密機械（虛構）",
  "owner": "機械設計課",
  "confidentiality": "機密",
  "cad": "kb/cad/mfg-003.py",
  "drawing": "kb/drawings/mfg-003.png",
  "descriptions": [
    {
      "topic": "用途與組裝",
      "text": "本件是輸送滾筒的主傳動軸。兩端 Ø20 軸頸安裝 6204 深溝滾珠軸承，Ø30 段以 8×7 平鍵連接鏈輪傳遞扭力，Ø24 段作為軸承擋肩。",
      "source": "組裝作業標準 AS-SFT-3003 rev.A"
    },
    {
      "topic": "材料與熱處理",
      "text": "材料為 SCM440 鉻鉬鋼，整體調質至 HRC 28–32；兩端 Ø20 軸承位再做高週波表面淬火，表面硬度 HRC 50–55、硬化層深 1.0–1.5 mm，以提高耐磨性。",
      "source": "材料規範 MS-SCM440-01"
    },
    {
      "topic": "加工製程",
      "text": "工序 10：鋸床下料 Ø35×150 mm。工序 20：兩端鑽中心孔，CNC 車床以頂心夾持粗車各段外徑。工序 30：調質。工序 40：精車各段，軸承位留 0.2 mm 研磨量。工序 50：立式銑床以 Ø8 鍵槽銑刀銑鍵槽 8×4×40。工序 60：軸承位高週波淬火。工序 70：外圓研磨機研磨兩端 Ø20 至 k6。",
      "source": "製程規範 PS-SFT-3003 rev.A"
    },
    {
      "topic": "公差與檢驗",
      "text": "軸承位 Ø20k6（+0.015/+0.002），Ra 0.8；鍵槽寬 8N9（0/−0.036），鍵槽對軸心的對稱度 0.03 mm；各段對兩端中心孔公共軸線的圓偏擺 0.02 mm。以外徑測微器、鍵槽規與偏擺儀檢驗，軸承位 100% 全檢。",
      "source": "檢驗規範 QC-SFT-3003 rev.A"
    },
    {
      "topic": "常見不良與對策",
      "text": "高週波淬火後軸容易彎曲，淬火後必須以偏擺儀檢查並校直，偏擺超過 0.05 mm 時不得直接研磨，要退回校直。鍵槽端部應保留銑刀半徑 R4 的圓弧，不可做成尖角，以免應力集中造成斷軸。",
      "source": "品質異常報告 QA-2024-112"
    }
  ],
  "tags": [
    "軸",
    "SCM440",
    "CNC 車削",
    "鍵槽",
    "研磨",
    "高週波淬火"
  ]
}
